4;1;8;40108015;9511;UNIDAD EDUCATIVA LUIS BELTRAN PRIETO FIGUEROA;BARRIO: 23 DE ENERO. FRENTE AVENIDA SEXTA. IZQUIERDA CALLE AUTOPISTA REGIONAL DEL CENTRO. DERECHA CALLE PIAR. REFERENCIA A DOS CUADRA Y MEDIAS DEL AMBULATORIO
4;1;8;40108017;9520;ESCUELA BASICA FEDERICO GARCIA ARIAS;SECTOR: LA CABRERA. FRENTE CALLE DINO ANDREINI. IZQUIERDA CALLEJÓN SAN LUIS. DERECHA CARRETERA NACIONAL MARIARA MARACAY. REFERENCIA AL LADO DE LA IGLASIA INMACULADA CORAZON DE MARIA
4;1;8;40108018;9521;ESCUELA ESTADAL 24 DE JULIO;SECTOR COGOLLAL FRENTE CALLE PRINCIPAL. DERECHA CAMINO AREA BALDIA. IZQUIERDA CAMINO AREA BALDIA NUEVA PLANTA ELECTRICA CASA
4;1;8;40108024;9522;UNIDAD EDUCATIVA PRIVADA JESUS CAUTIVO.;BARRIO: LA COROMOTO. FRENTE AVENIDA 106. IZQUIERDA CALLE 9 COLON. DERECHA CALLE BRASIL. REFERENCIA FETRAARAGUA
4;1;8;40108026;9524;UNIDAD EDUCATIVA NACIONAL EL VIÑEDO;SECTOR: SAN VICENTE. FRENTE CALLE H . IZQUIERDA CALLE L. DERECHA CALLE PRINCIPAL
4;1;8;40108027;9525;UNIDAD EDUCATIVA PADRE JUAN JOSE ZUGARRAMUNDI (FE Y ALEGRIA);BARRIO SAN VICENTE DERECHA CALLE SEGUNDA TRANSVERSAL. FRENTE CALLE CAPITAN ZAFRANE A 50 METROS DE VERTEBERO DE BASURA CASA
4;1;8;40108028;9526;UNIDAD EDUCATIVA .ESTADAL GENERAL JOSE DE SAN MARTIN;URBANIZACIÓN: BASE SUCRE. FRENTE CALLE 9. IZQUIERDA AVENIDA 3. DERECHA AVENIDA 4. REFERENCIA AL LADO DE LA UNEFA
4;1;8;40108029;9527;UNIDAD EDUCATIVA PRIVADA. JUAN ANTONIO PEREZ BONALDE;SECTOR: 23 DE ENERO. FRENTE CALLE NUEVA NUMERO 83. IZQUIERDA CALLE SANTA EDUVIGES. DERECHA CALLE PIAR. REFERENCIA DIAGONAL AL SUPERMERCADO LA SIRENA
4;1;8;40108030;9528;CENTRO DE EDUCACIÓN INICIAL   JABILIO REYES OCHOA.;SECTOR: 23 DE ENERO. FRENTE CALLE URDANETA. IZQUIERDA CALLE NUEVA. DERECHA CALLE 4 AVENIDA. REFERENCIA DETRAS DE LA PESCADERIA LA SIRENA
4;1;8;40108031;9529;ESCUELA BASICA NACIONAL.BALBINA GALVIS  DE RODRIGUEZ;SECTOR: 23 DE ENERO. FRENTE CALLE URDANETA NUMERO 26. IZQUIERDA CALLE NUEVA. DERECHA CALLE CUARTA AVENIDA. REFERENCIA DETRAS DE LA PANADERIA LA SIRENA
4;1;8;40108032;9531;FUNDACION ORQUESTA  JUVENIL E INFANTIL DE ARAGUA;BARRIO: SAN VICENTE SECTOR I, LOS TUBOS. FRENTE CALLE 3. IZQUIERDA CALLE CAPITAN ZAFRANE
4;3;1;40301010;10210;ESCUELA BASICA NACIONAL CECILIO ACOSTA;SECTOR: LA OTRA BANDA. FRENTE CALLE CANDELARIA SUR. REFERENCIA A 20 METROS DE EL PARQUE LA ESTACION
4;1;8;40108034;9533;CASA DE LOS NINOS MAESTRO JOSE VICENTE GONZALEZ;BARRIO SAN VICENTE DERECHA CALLE UNO. IZQUIERDA CALLE TERCERA. FRENTE CALLE DOS AL LADO DE LA COMISARIA SAN VICENTE EDIFICIO
4;1;8;40108035;9534;UNIDAD EDUCATIVA DE ADULTO ESCUELA TALLER MONSEÑOR ARIAS BLANCO;SECTOR 23 DE ENERO DERECHA AVENIDA QUINTA. IZQUIERDA AVENIDA CUARTA. FRENTE CALLE URDANETA A DOS CUADRA DE LA AMBULATORIO DE 23 DE ENERO EDIFICIO
4;1;8;40108036;9535;UNIVERSIDAD POLITECNICA TERRITORIAL DE ARAGUA EXTENCION MARACAY;URBANIZACIÓN COROMOTO DERECHA CALLE COSTANERA. IZQUIERDA CALLE MADRID. FRENTE CALLE PROLONGACION PARAISO AL FRENTE DEL INCES EL LIMON EDIFICIO
4;1;8;40108037;9536;TALLER DE EDUCACION LABORAL NACIONAL SAN VICENTE EDUCACION ESPECIAL;BARRIO SAN VICENTE FRENTE AVENIDA TRES. DERECHA CALLE DOS. IZQUIERDA CALLE UNO AL FRENTE DE LA CANCHA TECHADA CASA
4;2;1;40201012;9832;UNIDAD EDUCATIVA PRIVADA BICENTENARIO DE LA INDEPENDENCIA;URBANIZACIÓN: VALLE LINDO. FRENTE CALLE 2. IZQUIERDA CALLE 3. REFERENCIA DETRAS DEL ESTADIUM
4;2;1;40201003;9850;ESCUELA BASICA NACIONAL TURMERO;SECTOR: GUANARITO. FRENTE CALLE EL COLEGIO. IZQUIERDA CALLE PENALVER. REFERENCIA AL FRENTE DE LA FABRICA DE CABILLAS
4;2;1;40201004;9880;CICLO COMBINADO RAMON BASTIDAS;URBANIZACIÓN TURMERO IZQUIERDA CALLE CALLE RIVAS. FRENTE CALLE FINAL DE CAMILO TORRES. DERECHA CALLEJÓN SIN NOMBRE FRENTE A LA URBANIZACION EL NISPERO EDIFICIO
4;2;1;40201005;9882;CENTRO SUPERIOR EDUCACION ESPECIAL ARTURO SARCO VILLENA;SECTOR CASCO TURMERO DERECHA CALLE NEGRO PRIMERO. FRENTE CALLE CAMILO TORRES FRENTE DEL AUTOLAVADO MOLECDULA CASA
4;2;1;40201006;9890;ESCUELA BASICA JOSE RAFAEL REVENGA;SECTOR: CENTRO. FRENTE PASAJE LA HACIENDITA. IZQUIERDA CALLE URDANETA. REFERENCIA FRENTE SUPERMERCADO CASA
4;2;1;40201008;9893;UNIDAD EDUCATIVA LIBERTADOR;SECTOR: CASCO TURMERO. FRENTE CALLE BOLIVAR. IZQUIERDA CALLE CEDENO. REFERENCIA FRENTE DEL LICEO LA CANDELARIA
4;2;1;40201009;9895;ESCUELA BASICA LA CANDELARIA;SECTOR: CASCO  TURMERO. FRENTE CALLE BOLIVAR. REFERENCIA DETRAS DE LA CATEDRAL DE TURMERO
4;2;1;40201010;9900;ESCUELA BASICA ESTADO MIRANDA;SECTOR: PUEBLO NUEVO NORTE TURMERO. FRENTE CALLE CARRENO. REFERENCIA DIAGONAL A LA PANADERIA PUEBLO NUEVO
4;2;1;40201011;10020;ESCUELA GRADUADA MARIANO PICON SALAS;SECTOR: LA JULIA. FRENTE CALLE EZEQUIEL ZAMORA. IZQUIERDA CALLE 13 DE FEBRERO. REFERENCIA FRENTE A LA PLAZA LA DE JULIA
4;2;1;40201013;10021;UNIDAD EDUCATIVA NACIONAL  NUESTRA SEÑORA DE LA CARIDAD DEL COBRE;SECTOR: CASCO DE TURMERO. FRENTE CALLE URDANETA. IZQUIERDA CALLE BERMUDEZ. REFERENCIA DIAGONAL A LA PLAZA PEDRO VILLACASTIN
4;2;2;40202001;9810;ESCUELA BASICA ROSA AMELIA FLORES;SECTOR: 19 DE ABRIL. FRENTE CALLE GONZALITO. IZQUIERDA AVENIDA INTERCOMUNAL. REFERENCIA FRENTE AL ESTADIUM DEL BARRIO 19 DE ABRIL
4;2;2;40202002;9811;ESCUELA BASICA JOSEFINA BOLIVAR DE GONZALEZ;SECTOR: 19 DE ABRIL. FRENTE CALLE ALBERTO CARNAVALLI. IZQUIERDA CALLE ALMENDRONES. REFERENCIA A 100 METROS DE LA PLAZA 19 DE ABRIL
4;2;2;40202003;9812;CICLO COMBINADO GONZALITO;SECTOR: GONZALITO. FRENTE CALLE GONZALITO. IZQUIERDA CALLE SANTA BARBARA. REFERENCIA FRENTE AL CDI ANCA
4;2;2;40202011;9813;ESCUELA BASICA ESTADAL CRISTINA BATISTA;SECTOR: EL MACARO. FRENTE AVENIDA PRINCIPAL EL MACARO. IZQUIERDA CALLE UNO. REFERENCIA FRENTE AL COMPLEJO TURISTICO YESTERDAY BOLIVAR SECTOR EL MACARO TURMERO
4;2;2;40202004;9814;ESCUELA PRACTICA DE AGRICULTURA LA PROVIDENCIA INCE;SECTOR: LA PROVIDENCIA. FRENTE AVENIDA INTERCOMUNAL TURMERO MARACY. REFERENCIA FRENTE A LA ENTRADA A GONZALITO
4;2;2;40202013;9830;ESCUELA PEDRO VILLACASTIN;SECTOR: TURMERITO. FRENTE CALLE LOSPERICOCOS. IZQUIERDA AVENIDA PRINCIPAL DE TURMERITO
4;2;2;40202005;9860;ESCUELA BASICA IVON GONZALEZ MARCANO;SECTOR: LA MORITA UNO. FRENTE CALLE ESTE DOS. IZQUIERDA CALLE DOCTOR MANTOYA. REFERENCIA DIAGONAL A DIGA CENTER
4;2;2;40202008;9940;ESCUELA BASICA ESTADAL CESAR RODRIGUEZ PALENCIA;SECTOR: CESAR RODRIGUES PALENCIA. FRENTE CALLE PARAMACONI. IZQUIERDA CALLE MARA. REFERENCIA FRENTE  LA PLAZA
4;2;2;40202009;9941;CICLO BASICO MARI/O;SECTOR: ARTURO MICHELENA. FRENTE CALLE 5 DE JULIO. REFERENCIA AL LADO DEL PREESCOLAR MARIÑO
4;2;2;40202010;9943;ESCUELA BASICA PROFESORA ARGELIA LAYA;BARRIO SAMAN TARAZONEROS 2 IZQUIERDA AVENIDA INTERCOMUNAL MARACAY TURMERO. DERECHA CALLE SIN MONBRE. FRENTE CALLE PRINCIPAL DEL SAMAN TARAZONERO FRENTE A LA ENTRADA DE  LA URBANIZACION SAMAN TARAZONERO EDIFICIO
4;2;2;40202014;9944;UNIDAD EDUCATIVA NACIONAL  SAMAN DE GUERE.;SECTOR SAMAN DE GUERE SUR IZQUIERDA CALLE LIBERDOR. FRENTE CALLE PRINCIPAL DIAGONAL A LA PANADERIA LOS PORTUS EDIFICIO
4;2;2;40202015;9945;ESCUELA BASICA ESTADAL  ABIGAIL LOZANO;SECTOR: SAMAN DE GUERE. FRENTE CALLE PRINCIAPL SAMAN DE GUERE. REFERENCIA FRENTE LA CAPILLA
4;2;2;40202016;9946;ESCUELA BASICA NACIONAL  CREACION SOROCAIMA;SECTOR ESTEBAN LIENDO DERECHA CALLE 5 DE DICIEMBRE. IZQUIERDA CALLE ESTE 1. FRENTE CALLE TERESA DE LA PARRA DIAGONAL A LA AVENIDA LA MORITA EDIFICIO
4;2;2;40202017;9947;ESPACIO  ALTERNATIVO NO CONVENCIONALES LA CASONA II;BARRIO: LA CASONA 2. FRENTE CALLE PRINCIPAL NUMERO 13. IZQUIERDA AVENIDA INTERCOMUNAL. REFERENCIA DIAGONAL AL TANQUE
4;2;2;40202018;9948;UNIDAD EDUCATIVA ESTADAL  ANDRES PACHECO MIRANDA;SECTOR GUERITO IZQUIERDA CALLE GONZALITO. FRENTE CALLE GUERITO DIAGONAL A GRANIMARMOL EDIFICIO
4;2;2;40202019;9949;ATENCIÓN NO CONVENCIONAL NACIONAL SOROCAIMA I.;SECTOR: SOROCAIMA UNO. FRENTE CALLE PASAJE CHARAIIA. REFERENCIA FRENTE A LA PLAZA SOROCAIMA
4;2;2;40202020;9952;CENTRO SOCIAL MARACAY SOS;SECTOR EL MACARO DERECHA CALLE S/N. IZQUIERDA CALLE PRINCIPAL EL MACARO. FRENTE CALLE SERVICIIO AL FRENDDE DE LA ALDEA BOLIVARIANA CASA
4;3;5;40305002;10281;CENTRO MOVIL ESTADIUM DEL POBLADO LAS GUACAMAYAS.;SECTOR: GUACAMAYA. REFERENCIA FRENTE AL ESTADIUM GUACAMAYA
4;2;3;40203002;9942;UNIDAD EDUCATIVA ESTADAL LAURA PACHECO MONSERRAT;SECTOR: SAN JOAQUIN. FRENTE CALLE SEGUNDA TRASVERSAL. IZQUIERDA CALLE PRIMERA. REFERENCIA FRENTE AL TANQUE DE AGUA
4;2;3;40203003;10030;ESCUELA BASICA FRANCISCO LINARES ALCANTARA;BARRIO SAN JOAQUIN DERECHA CALLE SIN NOMBRE. IZQUIERDA CALLE CEDENO. FRENTE CALLE 5 DE JULIO CERCA DE LA IGLESIA CASA
4;2;3;40203004;10031;UNIDAD EDUCATIVA DOCTORA PRISILA LOPEZ;SECTOR: COLINAS DE SAN JOAQUIN. FRENTE CALLE 12. IZQUIERDA CALLE ROSALES DE SAN JOAQUIN. DERECHA CALLE EL CANAL. REFERENCIA FRENTE DE LA URBANIZACION BUGAVILLA
4;2;3;40203005;10032;PREESCOLAR NACIONAL BOLIVARIANO EL TIERRAL.;BARRIO: SAN JOAQUIN. FRENTE CALLE PRINCIPAL DE SAN JOAQUIN. IZQUIERDA CAMINO DE TIERRA SIN NOMBRE. REFERENCIA 50METROS DEL CENTRO DE DIAGNOSTICO INTEGRAL
4;2;3;40203006;10033;PREESCOLAR BOLIVARIANO EL TIERRAL;BARRIO ELL TIERRAL FRENTE CALLE CALLE 7 A 50 METROS DE LA PANADERIA CASA
4;2;4;40204001;9950;UNIDAD EDUCATIVA ESTADAL JOSE CASANOVA GODOY;CASERÍO CHUAO DERECHA CALLE ESTADIUN. IZQUIERDA CALLE ESTADIUN. FRENTE CALLE TEJERIA CERCADEL ESTADIUN CASA
4;2;4;40204002;9951;ESCUELA BASICA CONCENTRADA CEPE;SECTOR: CEPE. FRENTE CALLE PRINCIPAL DE CEPE. REFERENCIA CASERIO CEPE FRENTE A LA BIBLIOTECA VIRTUAL
4;2;5;40205001;9870;ESCUELA GUARAUGUTA;SECTOR: LA GUZMAN. FRENTE CALLE EZEQUIEL ZAMORA. REFERENCIA A CIEN METROS DE LA BOMBA DE AGUA
4;2;5;40205009;9871;UNIDAD EDUCATIVA ESTADAL BALBINO BLANCO SANCHEZ;SECTOR: ROSARIO DE PAYA. FRENTE AVENIDA PRINCIPAL. REFERENCIA AL LADO DE LA COMISARIA DE PANTIN
4;2;5;40205002;9960;ESCUELA ESTADAL UNITARIA Nº 184;CASERÍO: COBALONGO. FRENTE CALLE PRINCIPAL DE CABALONGO. REFERENCIA FRANTE AL MERCAL DE COBALONGO
4;2;5;40205003;9980;ESCUELA BASICA DOCTOR RAFAEL SEIJAS;SECTOR ROSARIO DE PAYA LAS RURALES IZQUIERDA CALLE BOLIVAR. FRENTE CALLE SUCRE. DERECHA CAMINO SIN NOMBRE FRENTE DE LA CAPILLA CASA
4;2;5;40205004;9981;ESCUELA LA MARCELOTA;SECTOR LA MARCELOTA FRENTE CALLE BOLIVAR FRENTE LA PLAZA DE LA MARCELOTA CASA
4;2;5;40205005;9982;UNIDAD EDUCATIVA ESTADAL RAFAEL TAYLHADAT;SECTOR: PRADOS DE PAYA. FRENTE CALLE UNO. REFERENCIA DETRAS DE LA URBANIZACION TERRAZAS DE PAYA
4;2;5;40205006;9990;UNIDAD EDUCATIVA ESTADAL CONCENTRADA EL PEDREGAL;CASERÍO: PEDREGAL. FRENTE CALLEJÓN LA CANDELARIA
4;2;5;40205007;10000;UNIDAD EDUCATIVA ESTADAL ROSELIANO BLANCO SANCHEZ;CASERÍO: POLVORIN. FRENTE PASAJE SN. IZQUIERDA CALLE 3 DE MAYO. REFERENCIA FRENTE A LA IGLESIA
4;2;5;40205008;10010;ESCUELA BASICA SANTIAGO MARI O;SECTOR: PAYITA. FRENTE AVENIDA PRINCIPAL PAYITA. REFERENCIA AL LADO DEL MODULO DE SALUD DE PAYITA
4;2;5;40205010;10011;ESCUELA BASICA ESTADAL CONCENTRADA ROSA BARRETO;CASERÍO: PAYA ABAJO. FRENTE AVENIDA PRINCIPAL ROSARIO DE PAYA. REFERENCIA AL FRENTE DE LA OLLERA INMACULADA
4;2;5;40205011;10012;UNIDAD EDUCATIVA RURAL FELIX MANUEL LUCES;SECTOR: EL CAMBUR TURMERO. FRENTE CALLE PRINCIPAL EL CAMBUR. REFERENCIA DETRAS DEL TERMINAL DE PASAJEROS EL CAMBUR
4;2;5;40205012;10013;LICEO BOLIVARIANO ROSARIO DE PAYA.;SECTOR: CANAIMA PAYA. FRENTE CALLE CALLE 7. REFERENCIA AL LADO DE LA URBANIZACION LA FUNDACION (LOS TECHOS AZULES)
4;2;5;40205013;10014;INSTITUTO  ESCUELA ESPECIALROSARIO DE PAYA;SECTOR: PAYA ABAJO. FRENTE AVENIDA PRINCIPAL. IZQUIERDA CALLE LA CAPILLA. REFERENCIA AL LADO DE LA CAPILLA
4;2;5;40205014;10015;ESCUELA BASICA NACIONAL PEDRO AREVALO APONTE;SECTOR RIO SECO FRENTE AVENIDA PRINCIPAL DE RIO SECO. IZQUIERDA CALLE 29 AL FRENTE DEL HOGAIN CASA
4;2;5;40205015;10016;UNIDAD EDUCATIVA ESTADAL RURAL ALFONZO RIVAS;SECTOR VALLECITO FRENTE CALLE ARAGUANEY CERCA DE LA Y CASA
4;2;5;40205016;10017;UNIDAD EDUCATIVA ESTADAL RURAL CONCENTRADA LAS MERCEDES DE PAYA;CASERÍO LAS MERCEDES FRENTE CALLE PRINCIPAL DE LAS MERCEDES AL FRENTE DE LA CASA DE ALIMENTACION CASA
4;3;1;40301001;10110;UNIDAD EDUCATIVA ESTADAL 23 DE ENERO;BARRIO: 23 ENERO. FRENTE CALLE PRINCIPAL 23 DE ENERO. REFERENCIA DIAGONAL AL MODULO POLICIAL
4;3;1;40301016;10111;UNIDAD EDUCATIVA COLEGIO MARIA DE LA PAZ;URBANIZACIÓN: BOLIVAR SUR. FRENTE CALLE LA PAZ. REFERENCIA DETRAS DEL BANCO DE VENEZUELA
4;3;1;40301017;10112;UNIDAD EDUCATIVA PRIVADA COLEGIO FRANCISCO MIGUEL JAIME OCHOA;SECTOR: AVENIDA RIVAS DAVILA SECTOR ESTE. FRENTE CALLE RIVAS DAVILA. IZQUIERDA CALLE CALLE GUILLERMO OVIEDO. DERECHA CALLE CANDELARIA SUR. REFERENCIA DIAGONAL AL ABASTO CECILIO SILVA
4;3;1;40301002;10130;ESCUELA BASICA SERGIO MEDINA;BARRIO: JESUS. FRENTE CALLE . IZQUIERDA CALLE MODULO ASISTENCIAL NINO JESUS. REFERENCIA FRENTE A LA CASA PIAMONTE
4;3;1;40301003;10150;ESCUELA BASICA ESTADAL JOSE MARIA ALVAREZ JARAMILLO;SECTOR: CASCO CENTRAL. FRENTE CALLE ADARRAGA. REFERENCIA AL FRENTE DE LA ALCALDIA
4;3;1;40301004;10160;CICLO DIVERSIFICADO JOSE FELIX RIVAS;SECTOR CASCO CENTRAL FRENTE AVENIDA VICTORIA. IZQUIERDA CALLE CARACAS A 50 METROS DE LA AVENIDAD SOCO DE LA VICTORIA EDIFICIO
4;3;1;40301005;10161;ESCUELA BASICA BRITO;URBANIZACIÓN: BOLIVAR NORTE. FRENTE CALLE MIRANDA. IZQUIERDA CALLE SUCRE. REFERENCIA AL LADO DE LA FUNERARIA
4;3;1;40301007;10170;ESCUELA TECNICA INDUSTRIAL;URBANIZACIÓN: BOLIVAR NORTE. FRENTE CALLE BICENTELLI. IZQUIERDA CALLE JUAN VICENTE BOLIVAR POCEN. DERECHA CALLE PAEZ. REFERENCIA FRENTE DE LOS BOMBEROS DE LA URBANIZACION BOLIVAR NORTE
4;3;1;40301008;10172;UNIDAD EDUCATIVA NACIONAL 12 DE FEBRERO;URBANIZACIÓN: BOLIVAR NORTE. FRENTE CALLE GARCIAS DE SENA. REFERENCIA AL LADO DE LA UNIDAD EDUCATIVA NACIONAL RUBEN DARIO
4;3;1;40301009;10190;UNIDAD EDUCATIVA NACIONAL RUBEN DARIO;URBANIZACIÓN: BOLIVAR NORTE. FRENTE CALLE GARCIAS DE SENA. IZQUIERDA CALLE PAEZ. REFERENCIA AL LADO DE LA UNIDAD EDUCATIVA NACIONAL 12 DE FEBRERO
4;3;1;40301011;10212;COLEGIO MADRE EMILIA;SECTOR LA OTRA BANDA DERECHA CALLE SERGIO MEDINA. IZQUIERDA CALLE MARIANO MONTILLA. FRENTE CALLE LIBERTADOR AL LADO DEL CUARTEL MONTILLA EDIFICIO
4;3;1;40301012;10220;ESCUELA BASICA ESTADAL AMERICA FERNANDEZ DE LEONI;BARRIO LA CHAPA FRENTE CALLE GRAN COLOMBIA FRENTE DE BOMBA MARVAR EDIFICIO
4;3;1;40301013;10260;ESCUELA BASICA NACIONAL LA QUEBRADA;SECTOR: LA QUEBRADA. FRENTE CARRETERA NACIONAL. REFERENCIA AL LADO DE LA SALA DE BATALLA INDIO RANGEL
4;3;1;40301014;10270;UNIDAD EDUCATIVA ESTADAL RURAL PIE DE CERRO;SECTOR: PIE DEL CERRO. FRENTE CARRETERA CARRETERA A LA COLONIA TOVAR. IZQUIERDA TROCHA RIO SAN CARLOS. REFERENCIA AL LADO DEL CDI
4;3;1;40301018;10271;ESCUELA BASICA ESTADAL RUDENCINDO CANELON;SECTOR: EL CEMENTERIO. FRENTE CALLE RUDECINDO CANELON. REFERENCIA FRENTE AL CEMENETERIO MUNICIPAL DE LA VICTORIA
4;3;1;40301019;10272;UNIDAD EDUCATIVA NACIONAL FRANCISCO JAVIER USTARIZ;SECTOR: BARRIO JESUS. FRENTE CARRETERA COLONIA TOVAR. IZQUIERDA PASAJE PASAJE AL AMBULATORIO CDI. DERECHA CARRETERA CARRETERA A LA COLONIA. REFERENCIA FRENTE A LA PLAZA
4;3;1;40301020;10273;BIBLIOTECA VIRTUAL DE LA VICTORIA;SECTOR: CASA AMARILLA PLAZA RIBAS DE LA VICTORIA. FRENTE CALLE CALLE SOUBLETTE. DERECHA CALLE AL LADO CASA DE LA MUJER. REFERENCIA AL LADO DE LA PLAZA RIBAS.  ANTIGUA CASA AMARILLA,
4;3;1;40301021;10274;CENTRO LA CASONA;SECTOR LA OTRA BANDA FRENTE CALLE CANDELARIA SUR. DERECHA SENDERO PARQUE LA ESTACION. IZQUIERDA SENDERO PARQUE LA ESTACION PARQUE LA ESTACION LA OTRA BANDA CASA
4;3;2;40302001;10250;LICEO BOLIVARIANO ZUATA;SECTOR ZUATA IZQUIERDA CALLE JOSE CASANOVA GODOY. FRENTE CALLE SERGIO MEDINA. DERECHA CALLEJÓN SIN NOMBRE QUEBRADA SECA EDIFICIO
4;3;2;40302002;10251;UNIDAD EDUCATIVA NACIONAL ZUATA NUEVA SEDE;SECTOR: SECTOR BELLO MONTE II. FRENTE AVENIDA  ROMULO BETANCOURT. REFERENCIA AL LADO DE LA CANCHA
4;3;2;40302003;10290;UNIDAD EDUCATIVA ESTADAL NEGRA MATEA;SECTOR ZUATA DERECHA CALLE SIN NOMBRE. IZQUIERDA CALLE SIN NOMBRE. FRENTE CARRETERA NACIONAL FRENTE A LA INVASION EL INDIO EDIFICIO
4;3;2;40302005;10292;UNIDAD EDUCATIVA NACIONAL SIMON BOLIVAR;SECTOR EL CASTANO FRENTE CALLE CALLE 4 CERCA DEL MODULO POLICIAL CASA
4;3;2;40302006;10293;UNIDAD EDUCATIVA ESTADAL PRIMITIVO DE JESUS;SECTOR PRIMITIVO DE JESUS IZQUIERDA CALLE COLON. FRENTE CALLE MARCOS LOBATO DIAGONAL AL LICEO PRIMITIVO DE JESUS EDIFICIO
4;3;2;40302008;10295;UNIDAD EDUCATIVA PRIVADA NUESTRA SEÑORA DEL ROSARIO;SECTOR ZUATA IZQUIERDA CALLE SERGIO MEDINA. FRENTE CALLE ANDRES BELLO DIAGONAL A LA AGROFERRETERIA LT  E  HIJAS CASA
4;3;2;40302009;10296;PREESCOLAR BOLIVARIANO BELLO MONTE II;URBANIZACIÓN: BELLO MONTE. FRENTE AVENIDA AVENIDA ROMULO BETANCOURT. REFERENCIA DIAGONAL AL REGISTRO CIVIL
4;3;2;40302010;10297;UNIDAD EDUCATIVA NACIONAL CREACION JOBALITO;SECTOR: JOBALITO. FRENTE CALLE EL STADIUM. REFERENCIA DIAGONAL A LA QUEBRADA BLANCA
4;3;2;40302011;10298;PREESCOLAR BOLIVARIANO 12 DE FEBRERO;SECTOR CALLE PRINCIPAL DEL MAMON MIJAO CRUCE CON CALLE RICAURTE. SECTOR MAMON MIJAO. FRENTE CALLEJÓN PRINCIPAL. DERECHA VEREDA CALLEJON. IZQUIERDA VEREDA CALLEJON AL LADO DE LA CASA DE LA SENORA GLADYS ZAMBRANO CASA
4;3;2;40302013;10305;UNIDAD EDUCATIVA ESTADAL CONCENTRADA PUNTA DEL MONTE;CASERÍO PUNTA DEL MONTE FRENTE CARRETERA ZUATA SAN MATEO PUNTA DEL MONTE CASA
4;3;2;40302014;10306;CASA HOGAR MONSEÑOR LOPEZ AVELEDO;SECTOR SAN JOSE FRENTE CARRETERA NACIONAL CLUB HISPANO EDIFICIO
4;3;3;40303001;10240;UNIDAD EDUCATIVA ESTADAL RURAL CRUZ GUEVARA;CASERÍO EL PAO DERECHA CALLE SIN NOMBRE. IZQUIERDA CALLE SIN NOMBRE. FRENTE CARRETERA NACIONAL AL LADO DE LA PREFECTURA EDIFICIO
4;3;4;40304001;10082;ESCUELA BASICA LUIS AUGUSTO MACHADO;URBANIZACIÓN LAS MERCEDES FRENTE CALLE 4. DERECHA VEREDA 2 AL LADO EMISORA RADIO 103.9 EDIFICIO
4;3;4;40304011;10085;SERVICIO AUTONOMO CENTRO EUROVENEZOLANO DE DESARROLLO EMPRESARIAL;URBANIZACIÓN VISTA HERMOSA FRENTE AVENIDA PRINCIPAL VISTA HERMOSA. IZQUIERDA PROLONGACIÓN BICENTENARIA A 300 METROS  DEL PEAJE EDIFICIO
4;3;4;40304002;10100;UNIDAD EDUCATIVA NACIONAL LA VICTORIA;URBANIZACIÓN LAS MERCEDES DERECHA CALLE CALLE 3. IZQUIERDA CALLE SIN NOMBRE. FRENTE CALLE 4 AL FRENTE A LA CANCHA DEL SECTOR 4 EDIFICIO
4;3;4;40304003;10101;CENTRO CAPACITACION ADULTOS ESTADAL CARMEN PILAR FERNANDEZ;URBANIZACIÓN LAS MERCEDES IZQUIERDA AVENIDA 5. FRENTE AVENIDA AVENIDA PRINCIPAL LAS MERCEDAS. DERECHA CALLE 3 AL LADO DE LA COMANDANCIA DE LA POLICIA EDIFICIO
4;3;4;40304005;10103;UNIDAD EDUCATIVA NACIONAL RAMON GARCIA DE SENA;URBANIZACIÓN LAS MERCEDES FRENTE AVENIDA 3. DERECHA VEREDA COMANDANCIA D COMANDANCIA DE LA POLICIA ESTADO ARAGUA EDIFICIO
4;3;4;40304006;10361;ESCUELA BASICA NACIONAL LA MORA (A.I);URBANIZACIÓN: LA MORA I. FRENTE AVENIDA 24. IZQUIERDA AVENIDA 5. REFERENCIA AVENIDA  24 SIN NUMERO URBANIZACION  LA MORA LA VICTORIA
4;3;4;40304007;10362;ESCUELA BASICA NACIONAL MARIA LUISA ANTONINI DE PAREDES;URBANIZACIÓN: LA MORA I. FRENTE AVENIDA 3. IZQUIERDA CALLEJÓN 11. REFERENCIA FRENTE A LA PLATA DE HIDROCENTRO
4;3;4;40304008;10363;ESCUELA BASICA ELBA GONZALEZ DE GIL;URBANIZACIÓN: LA MORA I. FRENTE AVENIDA 24. REFERENCIA AL LADO DE LA PANADERIA PAN DORADO
4;3;4;40304009;10364;UNIDAD EDUCATIVA NACIONAL VICENTE EMILIO SOJO;URBANIZACIÓN: LA MORA. FRENTE AVENIDA 1. REFERENCIA AL LADO DE LA PLANTA DE HIDROCENTRO
4;3;4;40304010;10365;UNIDAD EDUCATIVA NACIONAL  MIGUEL ALVAREZ;URBANIZACIÓN: LA MORA I. FRENTE AVENIDA 36. REFERENCIA AL LADO DE LA PANADERIA LA MORA
4;3;5;40305001;10280;ESCUELA GRADUADA RICARDO MONTILLA;SECTOR DOS CAMINOS DERECHA CALLE TERRENO VALDIO. IZQUIERDA CALLE LA MORA. FRENTE CALLE CALLE LAS MARGARITAS DIAGONAL AL VIVERO EDIFICIO
4;3;5;40305003;10282;CASA DE INTEGRACION ESCUELITA VIEJA;SECTOR 4 ESCUELITA VIEJA DERECHA CALLE SIN NOMBRE. IZQUIERDA CALLE SIN NOMBRE. FRENTE CARRETERA VIA AL PAO ESCUELITA VIEJA CASA
4;4;1;40401001;10570;GRUPO ESCOLAR FRANCISCO IZNARDY;SECTOR CENTRO CALLE SUCRE IZQUIERDA AVENIDA AVENIDA NACIONAL. DERECHA CALLE CALLE BESUVIO. FRENTE CALLE CALLE SUCRE 50 METROS DEL COMANDO POLICIAL EDIFICIO
4;4;1;40401012;10571;ESCUELA BASICA ESTADAL AUGUSTA CARABALLO DE BLANCO;SECTOR: TORONQUEY. REFERENCIA DIAGONAL AL CEMENTERIO MUNICIPAL
4;4;1;40401013;10572;UNIDAD EDUCATIVA ESTADAL EL MAMON;BARRIO: EL MAMON. FRENTE CALLE PRINCIPAL DEL MANON. REFERENCIA FRENTE AL COMEDOR POPULAR DEL MAMON
4;4;1;40401002;10580;UNIDAD EDUCATIVA LAS COCUIZAS;SECTOR: CENTRO. FRENTE CALLE CALLE MONAGAS. REFERENCIA 60 METROS DEL BANCO DE VENEZUELA
4;4;1;40401003;10590;CICLO BASICO SAN CASIMIRO;SECTOR: CALLE MIRANDA. REFERENCIA A 30 METROS DE LA ALCALDIA
4;4;1;40401004;10591;ESCUELA BASICA ANDRES BELLO;SECTOR: LUCAS GUILLERMO CASTILLO. FRENTE CALLE LUCAS GUILLERMO CASTILLO. REFERENCIA 100 METROS DE LA UNEFA
4;4;1;40401005;10600;UNIDAD EDUCATIVA ESTADAL SANTA ANA;SECTOR: CENTRO. FRENTE CALLE LAS DELICIAS. REFERENCIA A 50 METROS DEL BANCO DE VENEZUELA
4;4;1;40401006;10610;ESCUELA EL LORO;CASERÍO: EL LORO. FRENTE AVENIDA PRINCIPAL
4;4;1;40401007;10620;ESCUELA ESTADAL UNITARIA Nº 572;CASERÍO: MONTE OSCURO. REFERENCIA 300 METROS DEL AMBULATORIO
4;4;1;40401008;10640;ESCUELA BOCA DE ZUATA 435-553;CASERÍO: ZUATA. FRENTE CALLE PRICIPAL DE ZUATA. REFERENCIA 30 METROS DEL MERCALITO COMUNAL
4;4;1;40401009;10641;ESCUELA COMPLETA Nº 476-253;CASERÍO: ESPERANZA. FRENTE CALLE CALLE LA ESPERANZA. REFERENCIA A 50 METROS DE LA CASA DEL CONSEJO COMUNAL
4;4;1;40401010;10650;UNIDAD EDUCATIVA ESTADAL RURAL COGOLLAL;CASERÍO: COGOLLAL. FRENTE CALLE PRINCIPAL DE COGOLLAL. REFERENCIA AL LADO DEL PREESCOLAR COGOLLAL
4;4;1;40401011;10670;ESCUELA ESTADAL UNITARIA Nº 137-528;CASERÍO: MUCURA. REFERENCIA 100 METROS DEL CLUB SOCIAL  MUCURA
4;4;1;40401014;10671;INSTITUTO DE EDUCACION ESPECIAL;SECTOR: LAS CASITAS. REFERENCIA A 50 METROS DEL MANANTIAL DE AGUAS SULFUROZAS
4;4;1;40401015;10672;UNIDAD ESTADAL GOLFO TRISTE;CASERÍO GOLFO TRISTE DERECHA CALLE NO TIENE. IZQUIERDA CALLE NO TIENE. FRENTE CALLE PRINCIPAL DIAGONAL BODEGA DANIEL NELLY CASA
4;4;2;40402001;10700;ESCUELA BASICA VALLE MORIN;CASERÍO VALLE MORIN DERECHA CALLE PRINCIPAL. IZQUIERDA CALLE PRINCIPAL. FRENTE CALLE PRINCIPAL FRENTE A LA PLAZA BOLIVAR EDIFICIO
4;4;2;40402002;10701;ESCUELA BASICA NACIONAL BELEN MARTINEZ;CASERÍO PLAN DE CAGUA DERECHA CALLE PARADA. IZQUIERDA CALLE PRINCIPAL. FRENTE CARRETERA VALLE MORIN BODEGA JUANA AL FRENTE CASA
4;4;3;40403001;10630;ESCUELA NACIONAL CONCENTRADA Nº 227-3020;CASERÍO CALLE PRINCIPAL DE GUIRIPA DERECHA CALLE DIRECCION HACIA LA PLAZA. IZQUIERDA CALLE CAMPO DEPORTIVO. FRENTE CALLE PRINCIPAL CASERIO GUIRIPA GALPÓN
4;4;3;40403002;10631;UNIDAD EDUCATIVA RURAL CARUTICO;CASERÍO CARUTICO DERECHA CALLE SIN NOMBRE. IZQUIERDA CALLE SIN NOMBRE. FRENTE CALLE PRINCIPAL AL LADO DEL AMBULATORIO DE CARUTICO CASA
4;4;3;40403003;10632;ESCUELA BASICA ESTADAL GUAMBRA;CASERÍO GUAMBRA DERECHA CALLE NO TIENE. IZQUIERDA CALLE NO TIENE. FRENTE CALLE PRINCIPAL CASERIO LA GUAMBRA A 200 MTS MERCALITO COMUNAL CASA
4;4;4;40404001;10710;ESCUELA CONCENTRADA Nº 88-383-387-467-537;CASERÍO OLLAS DE CAMBURAL DERECHA CALLE DE LA IGESIA. FRENTE CALLE PRINCIPAL . IZQUIERDA CALLEJÓN SIN NOMBRE FRENTE A LA IGLESIA EVANGELICA EDIFICIO
4;4;4;40404002;11090;ESCUELA UNITARIA Nº 109;CASERÍO: CAMBURAL. REFERENCIA AL LADO DEL AMBULATORIO EL CAMBURAL
4;4;4;40404003;11091;ESCUELA BASICA ESTADAL CONCENTRADA LOS MANIRE;CASERÍO LOS MANIRES FRENTE CALLE PRINCIPAL. IZQUIERDA CALLEJÓN SIN NOMBBRE FRENTE A LA IGLESIA DIVINO NINO CASA
4;5;1;40501001;10730;ESCUELA BASICA PEDRO ALDAO;BARRIO: LA ESPERANZA. FRENTE CALLE PRINCIPAL. REFERENCIA AL LADO DEL SAMAN
4;5;1;40501011;10731;UNIDAD EDUCATIVA NACIONAL WENCESLAO CASADO FONSECA;CASERÍO: SAN SEBASTIAN. FRENTE CALLE BOLIVAR SUR. REFERENCIA DIAGONAL AL CEMENTERIO
4;5;1;40501002;10750;CICLO BASICO ELICEO ACOSTA;SECTOR: CUATRICENTENARIO 1. FRENTE CALLE LA PISTA. IZQUIERDA CARRETERA NACIONAL SAN JUNA DE LOS MORROS SAN CASIMIRO. REFERENCIA A 20 METROS DE LA SEDE DEL CENDA
4;5;1;40501003;10753;MODULO DE SERV CUATRICENTENARIO;URBANIZACIÓN: MATA REDONDA. FRENTE AVENIDA 100. IZQUIERDA CALLE 20. REFERENCIA A 20 METROS DEL CDI CUATRICENTENARIO
4;5;1;40501005;10770;ESCUELA ESTADAL UNITARIA Nº 256;CASERÍO: VALLE LA CRUZ. REFERENCIA CASERIO VALLE DE LA CRUZ
4;5;1;40501006;10780;ESCUELA UNITARIA Nº 95;CASERÍO: QUEBRADA HONDA. REFERENCIA 500 METROS DE LA FABRICA DE LA CEMENTO SAN SEBASTIAN
4;5;1;40501007;10790;ESCUELA ESTADAL Nº 509;CASERÍO: EL NICUAL. REFERENCIA A 500 METROS DE LA BODEGA COLMENARES
4;5;1;40501008;10800;ESCUELA UNITARIA Nº 131;CASERÍO: VALLADOLID
4;5;1;40501009;10810;ESCUELA ESPECIAL GUARATE;CASERÍO: ASENTMIENTO CAMPESINO GUARATE. FRENTE CARRERA VIA VALLADOLID. IZQUIERDA CARRETERA VIA VALLADOLID. DERECHA CARRETERA VIA VALLADOLID. REFERENCIA A 50 METROS DE LA VENTA DE MANO
4;5;1;40501010;10840;ESCUELA CONCENTRADA LA GUAMA;CASERÍO: LA GUAMA. REFERENCIA DIAGONAL AL TALLER DE MOTO DE LA FAMILIA MACHUCA
4;5;1;40501012;10841;CENTRO DE EDUCACION INICIAL PEDRO ALDAO;URBANIZACIÓN: LA ESPERANZA. FRENTE VEREDA 1. IZQUIERDA VEREDA 2. DERECHA VEREDA 3. REFERENCIA FRENTE A LA PLAZA LA ESPERANZA.
4;5;1;40501013;10842;CASA DE LOS NIÑOS MADRE MARIA DE SAN JOSE;SECTOR: PARAISO. REFERENCIA A 100 METROS DE LA POSADA CASTILLO DE ORO
4;5;1;40501015;10844;UNIDAD EDUCATIVA NACIONAL BRISAS DE MOSOCO;SECTOR MOSOCO DERECHA CALLE SIN MONBRE. IZQUIERDA CALLE SIN NOMBRE. FRENTE CALLE ZONA INDUSTRIAL CERCA DEL CENTRO DE EDUCACION INICIAL PEDRO ALDAO CASA
4;6;1;40601001;10850;ESCUELA BASICA TAGUANES;SECTOR TAMBORITO DERECHA CALLE SIN NOMBRE. IZQUIERDA CALLE ZULIA. FRENTE CALLE CONSTITUCION CERCA DE LA IGLESIA DE TAMBORITO EDIFICIO
4;6;1;40601002;10851;ESCUELA BASICA MANUELITA SAENZ;URBANIZACIÓN: MANUELITA SAEZ. FRENTE CALLE 11 DE MANUELITA SAEZ. IZQUIERDA CALLE 8 URBANIZACION LAS VEGAS. DERECHA CALLE 10 MANUELITA SAEZ. REFERENCIA AL LADO DEL CDI OFTALMOLOGICO DE CAGUA
4;6;1;40601021;10852;UNIDAD EDUCATIVA COLEGIO ARAGUA ESTUDIANTIL;URBANIZACIÓN CIUDAD JARDIN FRENTE AVENIDA PRINCIPAL. DERECHA CALLE FLORIDA. IZQUIERDA CALLE 2-10 CERCA DEL TANQUE DE CIUDAD JARDIN EDIFICIO
